"Status","Start Time","Stop Time","Duration in ms","Parent Suite","Suite","Sub Suite","Test Class","Test Method","Name","Description"
"passed","Tue Dec 17 04:18:57 GMT 2024","Tue Dec 17 04:19:04 GMT 2024","7161","tests.georchestra-base","test_georchestra_apps","","","","Test the DataFeeder webapp","This test attempts to load the 'datafeeder'/'import' wizard page, from the DataFeeder geOrchestra webapp. As it requires to be logged into geOrchestra, an initial login is performed."
"passed","Tue Dec 17 04:18:53 GMT 2024","Tue Dec 17 04:18:55 GMT 2024","1627","tests.georchestra-base","test_georchestra_apps","","","","Test the 'create account' interface from the Console","This test attempts to load the 'create account' page from the Console."
"passed","Tue Dec 17 04:19:05 GMT 2024","Tue Dec 17 04:19:09 GMT 2024","4011","tests.georchestra-base","test_georchestra_apps","","","","Test the GeoServer webapp","This test attempts to load the GeoServer main page."
"passed","Tue Dec 17 04:18:21 GMT 2024","Tue Dec 17 04:18:53 GMT 2024","32231","tests.georchestra-base","test_georchestra_apps","","","","Test the GeoNetwork webapp","This test attempts to load GeoNetwork."
"passed","Tue Dec 17 04:18:55 GMT 2024","Tue Dec 17 04:18:57 GMT 2024","1181","tests.georchestra-base","test_georchestra_apps","","","","Test the 'password recovery' interface from the Console","This test attempts to load the 'password recovery' page from the Console."
"passed","Tue Dec 17 04:19:18 GMT 2024","Tue Dec 17 04:20:24 GMT 2024","65067","tests.georchestra-base","test_ingest_data","","","","Test the Datafeeder webapp and links","This test attempts to load a SHP file through datafeeder and check links."
"passed","Tue Dec 17 04:19:09 GMT 2024","Tue Dec 17 04:19:18 GMT 2024","8948","tests.georchestra-base","test_georchestra_apps","","","","Test the MapStore webapp","This test attempts to load the MapStore landing page."
