"Status","Start Time","Stop Time","Duration in ms","Parent Suite","Suite","Sub Suite","Test Class","Test Method","Name","Description"
"passed","Mon Dec 16 11:32:28 GMT 2024","Mon Dec 16 11:33:04 GMT 2024","35764","tests.georchestra-base","test_georchestra_apps","","","","Test the GeoNetwork webapp","This test attempts to load GeoNetwork."
"passed","Mon Dec 16 11:33:09 GMT 2024","Mon Dec 16 11:33:17 GMT 2024","8040","tests.georchestra-base","test_georchestra_apps","","","","Test the DataFeeder webapp","This test attempts to load the 'datafeeder'/'import' wizard page, from the DataFeeder geOrchestra webapp. As it requires to be logged into geOrchestra, an initial login is performed."
"passed","Mon Dec 16 11:33:07 GMT 2024","Mon Dec 16 11:33:08 GMT 2024","1377","tests.georchestra-base","test_georchestra_apps","","","","Test the 'password recovery' interface from the Console","This test attempts to load the 'password recovery' page from the Console."
"failed","Mon Dec 16 11:34:08 GMT 2024","Mon Dec 16 11:35:32 GMT 2024","84490","tests.georchestra-base","test_ingest_data","","","","Test the Datafeeder webapp and links","This test attempts to load a SHP file through datafeeder and check links."
"passed","Mon Dec 16 11:33:04 GMT 2024","Mon Dec 16 11:33:06 GMT 2024","1957","tests.georchestra-base","test_georchestra_apps","","","","Test the 'create account' interface from the Console","This test attempts to load the 'create account' page from the Console."
"passed","Mon Dec 16 11:33:22 GMT 2024","Mon Dec 16 11:33:33 GMT 2024","11478","tests.georchestra-base","test_georchestra_apps","","","","Test the MapStore webapp","This test attempts to load the MapStore landing page."
"passed","Mon Dec 16 11:33:17 GMT 2024","Mon Dec 16 11:33:22 GMT 2024","4606","tests.georchestra-base","test_georchestra_apps","","","","Test the GeoServer webapp","This test attempts to load the GeoServer main page."
